{
  "schema_version": "1.0.0",
  "registry_version": "pilot-0.3-world-endpoint",
  "numeric_policy": {
    "representation": "fixed_point_integer_where_research_relevant",
    "scale_policy": "declared_per_parameter",
    "rounding": "round_half_even",
    "overflow": "fail_closed",
    "underflow": "round_to_zero_and_record",
    "comparison": "exact_integer"
  },
  "unknown_parameter_policy": "confirmatory_validation_fails_closed",
  "parameters": [
    {
      "schema_version":"1.0.0",
      "parameter_id":"world.phase.budgets",
      "value":{"observation":360000,"private_planning":360000,"diplomacy":360000,"final_planning":360000,"validation":360000,"accepted_commit":360000,"resolution":360000,"consequence_reveal":360000,"memory_update":360000,"memory_archive":360000,"snapshot":360000,"interview":360000,"close":360000},
      "unit":"milliseconds-by-phase",
      "version":"pilot0-turn-phases-v1",
      "classification":"WORLD_CALIBRATION",
      "status":"PROVISIONAL",
      "rationale":"Explicit phase opportunities derive from the configured shared budget unless an explicit versioned override is recorded in the canonical phase command and effective registry entry.",
      "allowed_calibration_stage":"PILOT_0",
      "freeze_stage":"before_confirmatory_execution",
      "sensitivity_requirements":"PILOT_0_CALIBRATION_REQUIRED: treatment-neutral timing and opportunity adequacy; no outcome-directed optimization",
      "numeric_policy_ref":"registry.numeric_policy",
      "provenance":"Human provisional timing authorization; config.phases.actionBudgetMs plus canonical phase command overrides"
    },
    {
      "schema_version": "1.0.0",
      "parameter_id": "world.configuration.executionMode",
      "value": "synthetic",
      "unit": "evidence-classification",
      "version": "pilot-0.3",
      "classification": "CONFIRMATORY_ANALYSIS",
      "status": "PILOT_ONLY",
      "rationale": "Canonical genesis distinguishes synthetic conformance from separately authorized exploratory empirical collection; changing a label does not authorize execution or promote synthetic model output.",
      "allowed_calibration_stage": "never inferred or calibrated from outcomes",
      "freeze_stage": "run creation; immutable thereafter",
      "sensitivity_requirements": "Synthetic data must never enter empirical evidence through relabeling",
      "numeric_policy_ref": "registry.numeric_policy",
      "provenance": "Existing human build/non-empirical boundary and synthetic-versus-empirical runtime contract; registered to connect world genesis to archive analysis"
    },
    {
      "schema_version": "1.0.0",
      "parameter_id": "pilot_0.max_turns",
      "value": 20,
      "unit": "turns",
      "version": "pilot-0.1",
      "classification": "CONFIRMATORY_ANALYSIS",
      "status": "PILOT_ONLY",
      "rationale": "Fixed Pilot 0 measurement boundary; exploratory only.",
      "allowed_calibration_stage": "none",
      "freeze_stage": "pilot_0_manifest",
      "sensitivity_requirements": "report attrition and opportunity adequacy",
      "numeric_policy_ref": "registry.numeric_policy",
      "provenance": "human-ratified #12"
    },
    {
      "schema_version": "1.0.0",
      "parameter_id": "world.economy.resource_production",
      "value": {
        "farmer_food_per_turn": 3,
        "starting_food": 144
      },
      "unit": "ruleset-defined",
      "version": "pilot-0.1",
      "classification": "WORLD_CALIBRATION",
      "status": "PROVISIONAL",
      "rationale": "Neutral executable default; not selected using treatment outcomes.",
      "allowed_calibration_stage": "PILOT_0",
      "freeze_stage": "before_confirmatory_execution",
      "sensitivity_requirements": "pilot sensitivity and calibration report",
      "numeric_policy_ref": "registry.numeric_policy",
      "provenance": "WORLD.spec.md; ASTRA provisional default"
    },
    {
      "schema_version": "1.0.0",
      "parameter_id": "world.population.unit_conversion",
      "value": {
        "population_per_unit": 4,
        "recruitment_credit_cost": 4
      },
      "unit": "population/credits",
      "version": "pilot-0.1",
      "classification": "WORLD_CALIBRATION",
      "status": "PROVISIONAL",
      "rationale": "Neutral default preserving distinct concepts.",
      "allowed_calibration_stage": "PILOT_0",
      "freeze_stage": "before_confirmatory_execution",
      "sensitivity_requirements": "transition and dynamic-range checks",
      "numeric_policy_ref": "registry.numeric_policy",
      "provenance": "human-ratified #60; ASTRA provisional default"
    },
    {
      "schema_version": "1.0.0",
      "parameter_id": "world.combat.coefficients",
      "value": {
        "attack": 10,
        "defense": 8,
        "terrain_modifier": 1,
        "draw_threshold": 0.5
      },
      "unit": "ruleset-defined",
      "version": "pilot-0.1",
      "classification": "WORLD_CALIBRATION",
      "status": "PROVISIONAL",
      "rationale": "Neutral deterministic battle default.",
      "allowed_calibration_stage": "PILOT_0",
      "freeze_stage": "before_confirmatory_execution",
      "sensitivity_requirements": "battle replay and calibration report",
      "numeric_policy_ref": "registry.numeric_policy",
      "provenance": "human-ratified #61; ASTRA provisional default"
    },
    {
      "schema_version": "1.0.0",
      "parameter_id": "world.termination.objective_predicates",
      "value": [],
      "unit": "predicate-set",
      "version": "pilot-0.1",
      "classification": "CONFIRMATORY_ANALYSIS",
      "status": "PILOT_ONLY",
      "rationale": "Pilot 0 uses fixed cap and only absorbing states.",
      "allowed_calibration_stage": "PILOT_0",
      "freeze_stage": "before_confirmatory_execution",
      "sensitivity_requirements": "treatment-neutrality validation",
      "numeric_policy_ref": "registry.numeric_policy",
      "provenance": "human-ratified #12"
    },
    {
      "schema_version": "1.0.0",
      "parameter_id": "world.map.geometry",
      "value": {
        "width": 13,
        "height": 11,
        "contact_radius": 2
      },
      "unit": "cells",
      "version": "pilot-0.1",
      "classification": "WORLD_CALIBRATION",
      "status": "PROVISIONAL",
      "rationale": "Neutral executable map default.",
      "allowed_calibration_stage": "PILOT_0",
      "freeze_stage": "before_confirmatory_execution",
      "sensitivity_requirements": "contact opportunity report",
      "numeric_policy_ref": "registry.numeric_policy",
      "provenance": "ASTRA provisional default"
    },
    {
      "schema_version": "1.0.0",
      "parameter_id": "world.economy.consumption",
      "value": 1,
      "unit": "food/citizen/turn",
      "version": "pilot-0.1",
      "classification": "WORLD_CALIBRATION",
      "status": "PROVISIONAL",
      "rationale": "Executable neutral default.",
      "allowed_calibration_stage": "PILOT_0",
      "freeze_stage": "before_confirmatory_execution",
      "sensitivity_requirements": "attrition report",
      "numeric_policy_ref": "registry.numeric_policy",
      "provenance": "ASTRA provisional default"
    },
    {
      "schema_version": "1.0.0",
      "parameter_id": "world.economy.starting_credits",
      "value": 80,
      "unit": "credits",
      "version": "pilot-0.1",
      "classification": "WORLD_CALIBRATION",
      "status": "PROVISIONAL",
      "rationale": "Executable neutral default.",
      "allowed_calibration_stage": "PILOT_0",
      "freeze_stage": "before_confirmatory_execution",
      "sensitivity_requirements": "action opportunity report",
      "numeric_policy_ref": "registry.numeric_policy",
      "provenance": "ASTRA provisional default"
    },
    {
      "schema_version": "1.0.0",
      "parameter_id": "world.memory.capacity",
      "value": 240,
      "unit": "bytes",
      "version": "pilot-0.1",
      "classification": "WORLD_CALIBRATION",
      "status": "PROVISIONAL",
      "rationale": "Bounded executable memory default.",
      "allowed_calibration_stage": "PILOT_0",
      "freeze_stage": "before_confirmatory_execution",
      "sensitivity_requirements": "memory treatment fidelity report",
      "numeric_policy_ref": "registry.numeric_policy",
      "provenance": "ASTRA provisional default"
    },
    {
      "schema_version": "1.0.0",
      "parameter_id": "world.phase.action_budget",
      "value": 360000,
      "unit": "milliseconds",
      "version": "pilot-0.1",
      "classification": "WORLD_CALIBRATION",
      "status": "PROVISIONAL",
      "rationale": "Time available for inference changes action opportunities; not merely an engineering timeout.",
      "allowed_calibration_stage": "PILOT_0",
      "freeze_stage": "before_confirmatory_execution",
      "sensitivity_requirements": "PILOT_0_CALIBRATION_REQUIRED: timeout/attrition parity and computational feasibility; no effect-directed selection",
      "numeric_policy_ref": "registry.numeric_policy",
      "provenance": "Human authorizes provisional phase timing; corrected classification against runtime opportunity contract"
    },
    {
      "schema_version": "1.0.0",
      "parameter_id": "model.hf.artifact",
      "value": {
        "repository": "Qwen/Qwen3.5-9B-Base",
        "revision": "68c46c4b3498877f3ef123c856ecfde50c39f404",
        "quantization": "none",
        "runtime": "mlx-lm",
        "dtype": "checkpoint",
        "device": "metal"
      },
      "unit": "artifact-and-runtime",
      "version": "pilot-0.2-hf",
      "classification": "TREATMENT",
      "status": "PROVISIONAL",
      "rationale": "Model/runtime is invariant across Pilot 0 arms, not an experimental history-access difference; selected existing HF cache only.",
      "allowed_calibration_stage": "no_silent_changes",
      "freeze_stage": "before_empirical_pilot_0_then_confirmatory_freeze",
      "sensitivity_requirements": "artifact identity and treatment parity validation",
      "numeric_policy_ref": "registry.numeric_policy",